{
  "$schema": "http://json-schema.org/draft-07/schema#",
  "$id": "https://utsu-ri.dev/schemas/review-answer/v1",
  "title": "ReviewAnswer",
  "type": "object",
  "additionalProperties": false,
  "required": [
    "schemaVersion",
    "batchId",
    "itemId",
    "directAnswer",
    "evidence",
    "uncertainty",
    "suggestedNextActions",
    "metadata"
  ],
  "properties": {
    "schemaVersion": {
      "const": "1.0"
    },
    "batchId": {
      "type": "string",
      "pattern": "^fb[-:][A-Za-z0-9._:-]+$",
      "maxLength": 256
    },
    "itemId": {
      "type": "string",
      "pattern": "^item[-:][A-Za-z0-9._:-]+$",
      "maxLength": 256
    },
    "directAnswer": {
      "type": "string",
      "minLength": 1,
      "maxLength": 16384
    },
    "evidence": {
      "type": "array",
      "maxItems": 100,
      "items": {
        "type": "object",
        "additionalProperties": false,
        "required": [
          "ref",
          "explanation"
        ],
        "properties": {
          "ref": {
            "type": "string",
            "minLength": 1
          },
          "explanation": {
            "type": "string",
            "minLength": 1,
            "maxLength": 16384
          }
        }
      }
    },
    "uncertainty": {
      "type": "array",
      "maxItems": 100,
      "items": {
        "type": "string",
        "maxLength": 16384
      }
    },
    "suggestedNextActions": {
      "type": "array",
      "maxItems": 100,
      "items": {
        "type": "object",
        "additionalProperties": false,
        "required": [
          "type",
          "label"
        ],
        "properties": {
          "type": {
            "enum": [
              "inspect",
              "test",
              "recapture",
              "propose-patch",
              "none"
            ]
          },
          "label": {
            "type": "string"
          },
          "anchorRef": {
            "type": "string"
          }
        }
      }
    },
    "metadata": {
      "type": "object",
      "additionalProperties": false,
      "required": [
        "host",
        "contextHash"
      ],
      "properties": {
        "host": {
          "enum": [
            "codex",
            "claude-code",
            "unknown"
          ]
        },
        "originSessionRef": {
          "type": "string",
          "pattern": "^session:[a-f0-9]{64}$"
        },
        "answerTurnRef": {
          "type": "string"
        },
        "contextHash": {
          "type": "string",
          "pattern": "^[a-f0-9]{64}$"
        }
      }
    }
  }
}
